{
  "authority": "pre_result_contract_only_no_training_promotion_serving_or_gold_authority",
  "compatibility_rules": {
    "autonomy_certificates": {
      "decision": "invalidate",
      "exact_scope_dimensions": ["pipeline_fingerprint", "risk_bucket", "instance_context"],
      "rationale": "Autonomy certificates are fingerprint scoped and must be rebuilt or replaced by residual abstention.",
      "rule_id": "retraining_compatibility_v1.autonomy_certificates"
    },
    "benchmark_observations": {
      "decision": "reuse",
      "exact_scope_dimensions": ["provider", "model", "prompt", "code", "hardware", "eval_set"],
      "rationale": "Benchmark observations may be reused only when every execution and evaluation identity is byte-identical.",
      "rule_id": "retraining_compatibility_v1.benchmark_observations"
    },
    "human_anchor_holdout": {
      "decision": "reuse",
      "exact_scope_dimensions": ["dataset", "partition", "image_ids", "truth_authority"],
      "rationale": "Frozen human-anchor holdouts remain valid only with exact dataset, partition, image, and authority identity.",
      "rule_id": "retraining_compatibility_v1.human_anchor_holdout"
    },
    "human_gold_training": {
      "decision": "reuse",
      "exact_scope_dimensions": ["dataset", "partition", "image_ids", "truth_authority"],
      "rationale": "Approved human gold may be reused only with exact immutable package and partition identity.",
      "rule_id": "retraining_compatibility_v1.human_gold_training"
    },
    "immutable_audit_history": {
      "decision": "reuse",
      "exact_scope_dimensions": ["queue", "outcomes", "auditor_authority"],
      "rationale": "Historical audit outcomes are immutable observations and retain provenance without becoming a new certificate.",
      "rule_id": "retraining_compatibility_v1.immutable_audit_history"
    },
    "pseudo_labels": {
      "decision": "invalidate",
      "exact_scope_dimensions": ["pipeline_fingerprint", "certificate_bundle", "dataset_manifest"],
      "rationale": "Pseudo-label eligibility is certificate and fingerprint bound and must be regenerated after retraining.",
      "rule_id": "retraining_compatibility_v1.pseudo_labels"
    },
    "serving_promotion_evidence": {
      "decision": "invalidate",
      "exact_scope_dimensions": ["candidate", "checkpoint", "registry", "serving_smoke"],
      "rationale": "A new checkpoint requires a new promotion transaction and serving smoke; prior role authority cannot carry over.",
      "rule_id": "retraining_compatibility_v1.serving_promotion_evidence"
    }
  },
  "fingerprint_components": ["code_tree", "dataset_manifest", "model_checkpoint", "training_config"],
  "governing_source_hashes": {
    "configs/autonomous_masks.yaml": "417969a926e68d1cacbbe24b0a57fabcc93230b3ff61f79a358904ef9c739cb3",
    "src/maskfactory/autonomy/calibration.py": "ced9c4eecdc109cbae7397714f9971d7efdced276e08b68169c1e9b9fe3a5172",
    "src/maskfactory/autonomy/operations.py": "a30f1cda7c0ded91b72e6b7acb266c308e5840527e9a8a9e1e664db71c3e9214",
    "src/maskfactory/models/registry.py": "ca221580bc050dde18538f8876e3ef67cdf860d15ea7b234334ba5614cc2780a"
  },
  "policy_id": "retraining_compatibility_v1",
  "role_decision": {
    "allow_residual_abstention": true,
    "require_benchmark_pass": true,
    "require_frozen_holdout_pass": true
  },
  "rollback": {
    "require_exact_registry_restore": true,
    "require_serving_smoke": true,
    "required_for_promotion": true
  },
  "schema_version": "1.0.0",
  "sha256": "13052ede3e5d957887f730f56cf86db072b8273b8950276b07e8072e74d49bd5",
  "trigger_thresholds": {
    "minimum_audit_failures": 1,
    "minimum_new_human_corrections": 1
  }
}
